{
  "id": "external-cdn-demo",
  "title": "Demo CDN Feed",
  "description": "Sample feed demonstrating external CDN loading capabilities",
  "source": {
    "type": "cdn",
    "baseUrl": "https://example-cdn.com/media/kamiskaze/",
    "corsProxy": "",
    "headers": {
      "User-Agent": "Kamiskaze-Player/1.0"
    }
  },
  "tracks": [
    {
      "id": "external-track-1",
      "title": "Remote Track 1",
      "artist": "Kamiskaze",
      "audioUrl": "audio/track1.mp3",
      "albumArt": "images/album1.jpg",
      "thumbnail": "images/thumb1.jpg",
      "description": "First track from external CDN",
      "duration": 180,
      "metadata": {
        "genre": "Ska",
        "year": 2023
      }
    },
    {
      "id": "external-track-2",
      "title": "Remote Video Track",
      "artist": "Kamiskaze",
      "audioUrl": "video/track2.mp4",
      "videoUrl": "video/track2.mp4",
      "albumArt": "images/album2.jpg",
      "thumbnail": "images/thumb2.jpg",
      "description": "Video track from external CDN",
      "duration": 240,
      "metadata": {
        "genre": "Ska",
        "year": 2023
      }
    },
    {
      "id": "external-track-3",
      "title": "S3 Hosted Track",
      "artist": "Kamiskaze",
      "audioUrl": "https://s3.amazonaws.com/my-bucket/kamiskaze/audio/track3.mp3",
      "albumArt": "https://s3.amazonaws.com/my-bucket/kamiskaze/images/album3.jpg",
      "description": "Track with absolute URLs",
      "duration": 200,
      "metadata": {
        "genre": "Ska",
        "year": 2024
      }
    }
  ],
  "metadata": {
    "genre": "Ska",
    "year": 2023,
    "label": "Independent",
    "website": "https://github.com/jmcpheron/kamiskaze"
  }
}